{
  "id": "fractalis",
  "name": "Fractalis",
  "description": "Фрактальная тема. Hₙ = Hₙ₋₁ + 137.5°/φⁿ. Self-similar цвета. Dark = zoom на 1 итерацию.",
  "author": "SuperUI",
  "version": "1.0.0",
  "category": "Art",
  "additionalCss": ":root,\r\n[data-theme=\"light\"],\r\n[data-theme=\"dark\"] {\r\n    --sui-bg-primary:   var(--sg-bg);\r\n    --sui-bg-secondary: var(--sg-bg-subtle);\r\n    --sui-bg-tertiary:  var(--sg-bg-muted);\r\n    --sui-text-primary:   var(--sg-fg);\r\n    --sui-text-secondary: var(--sg-fg-subtle);\r\n    --sui-text-muted:     var(--sg-fg-muted);\r\n    --sui-text-disabled:  var(--sg-fg-disabled);\r\n    --sui-border:       var(--sg-border);\r\n    --sui-divider:      var(--sg-divider);\r\n    --sui-border-hover: var(--sg-border-strong);\r\n    --sui-border-focus: var(--sg-border-focus);\r\n    --sui-accent:        var(--sg-color-primary);\r\n    --sui-primary:       var(--sg-color-primary);\r\n    --sui-accent-hover:  var(--sg-color-primary-hover);\r\n    --sui-accent-active: var(--sg-color-primary-active);\r\n    --sui-success:        var(--sg-color-success);\r\n    --sui-success-bg:     var(--sg-color-success-subtle);\r\n    --sui-danger:        var(--sg-color-danger);\r\n    --sui-danger-bg:     var(--sg-color-danger-subtle);\r\n    --sui-warn:        var(--sg-color-warning);\r\n    --sui-warn-bg:     var(--sg-color-warning-subtle);\r\n    --sui-info:        var(--sg-color-info);\r\n    --sui-info-bg:     var(--sg-color-info-subtle);\r\n    --sui-shadow-sm: var(--sg-shadow-sm);\r\n    --sui-shadow-md: var(--sg-shadow-md);\r\n    --sui-shadow-lg: var(--sg-shadow-lg);\r\n    --sui-overlay-bg: var(--sg-bg-overlay);\r\n    --sui-glass-bg:     var(--sg-bg-glass);\r\n    --sui-glass-border: var(--sg-border-glass);\r\n    --sui-glass-blur:   var(--sg-blur-glass);\r\n    --sui-hover-bg:    rgba(15, 23, 42, 0.04);\r\n    --sui-active-bg:   rgba(15, 23, 42, 0.08);\r\n    --sui-selected-bg: var(--sg-color-primary-muted);\r\n    --sui-font-family:    var(--sg-font);\r\n    --sui-font-size-xs:   var(--sg-text-xs);\r\n    --sui-font-size-sm:   var(--sg-text-sm);\r\n    --sui-font-size-base: var(--sg-text-base);\r\n    --sui-font-size-lg:   var(--sg-text-lg);\r\n    --sui-radius-sm:   var(--sg-radius-sm);\r\n    --sui-radius-md:   var(--sg-radius-md);\r\n    --sui-radius-lg:   var(--sg-radius-lg);\r\n    --sui-radius-full: var(--sg-radius-full);\r\n}\r\n\r\n@media (prefers-reduced-motion: reduce) {\r\n    [data-theme-id=\"fractalis\"] *,\r\n    [data-theme-id=\"fractalis\"] *::before,\r\n    [data-theme-id=\"fractalis\"] *::after {\r\n        animation-duration: 0.01ms !important;\r\n        animation-iteration-count: 1 !important;\r\n        transition-duration: 0.01ms !important;\r\n        scroll-behavior: auto !important;\r\n    }\r\n}",
  "primitives": {
    "neutral": {
      "0": "oklch(1 0 0)",
      "50": "oklch(0.985 0.003 220)",
      "100": "oklch(0.97 0.005 220)",
      "200": "oklch(0.93 0.008 220)",
      "300": "oklch(0.87 0.01 220)",
      "400": "oklch(0.76 0.012 220)",
      "500": "oklch(0.64 0.012 220)",
      "600": "oklch(0.52 0.014 220)",
      "700": "oklch(0.40 0.016 220)",
      "800": "oklch(0.28 0.018 220)",
      "900": "oklch(0.16 0.02 220)"
    },
    "primary": {
      "50": "oklch(0.95 0.03 220)",
      "100": "oklch(0.90 0.06 220)",
      "200": "oklch(0.84 0.09 220)",
      "300": "oklch(0.76 0.12 220)",
      "400": "oklch(0.67 0.14 220)",
      "500": "oklch(0.59 0.14 220)",
      "600": "oklch(0.52 0.13 220)",
      "700": "oklch(0.44 0.12 220)",
      "800": "oklch(0.35 0.11 220)",
      "900": "oklch(0.26 0.09 220)"
    },
    "success": {
      "50": "oklch(0.95 0.03 135)",
      "100": "oklch(0.88 0.06 135)",
      "500": "oklch(0.58 0.12 135)",
      "600": "oklch(0.50 0.12 135)",
      "700": "oklch(0.42 0.11 135)"
    },
    "danger": {
      "50": "oklch(0.95 0.04 357.5)",
      "100": "oklch(0.88 0.09 357.5)",
      "500": "oklch(0.55 0.20 357.5)",
      "600": "oklch(0.48 0.20 357.5)",
      "700": "oklch(0.40 0.19 357.5)"
    },
    "warning": {
      "50": "oklch(0.97 0.03 82.5)",
      "100": "oklch(0.92 0.06 82.5)",
      "500": "oklch(0.70 0.14 82.5)",
      "600": "oklch(0.62 0.14 82.5)"
    },
    "info": {
      "50": "oklch(0.95 0.025 167.5)",
      "100": "oklch(0.88 0.05 167.5)",
      "500": "oklch(0.58 0.12 167.5)",
      "600": "oklch(0.50 0.12 167.5)"
    },
    "fonts": {
      "sans": "Orbitron, system-ui, -apple-system, sans-serif",
      "mono": "'Space Mono', 'JetBrains Mono', ui-monospace, monospace",
      "serif": "'Space Grotesk', sans-serif",
      "display": "Orbitron, system-ui, sans-serif",
      "medical": "'Space Mono', 'JetBrains Mono', ui-monospace, monospace"
    },
    "radius": {
      "none": "0",
      "xs": "2px",
      "sm": "4px",
      "md": "8px",
      "lg": "16px",
      "xl": "32px",
      "2xl": "64px",
      "full": "9999px"
    },
    "Neutral0": "oklch(1 0 0)",
    "Neutral50": "oklch(0.985 0.003 220)",
    "Neutral100": "oklch(0.97 0.005 220)",
    "Neutral200": "oklch(0.93 0.008 220)",
    "Neutral300": "oklch(0.87 0.01 220)",
    "Neutral400": "oklch(0.76 0.012 220)",
    "Neutral500": "oklch(0.64 0.012 220)",
    "Neutral600": "oklch(0.52 0.014 220)",
    "Neutral700": "oklch(0.40 0.016 220)",
    "Neutral800": "oklch(0.28 0.018 220)",
    "Neutral900": "oklch(0.16 0.02 220)",
    "Primary50": "oklch(0.95 0.03 220)",
    "Primary100": "oklch(0.90 0.06 220)",
    "Primary200": "oklch(0.84 0.09 220)",
    "Primary300": "oklch(0.76 0.12 220)",
    "Primary400": "oklch(0.67 0.14 220)",
    "Primary500": "oklch(0.59 0.14 220)",
    "Primary600": "oklch(0.52 0.13 220)",
    "Primary700": "oklch(0.44 0.12 220)",
    "Primary800": "oklch(0.35 0.11 220)",
    "Primary900": "oklch(0.26 0.09 220)",
    "Success50": "oklch(0.95 0.03 135)",
    "Success100": "oklch(0.88 0.06 135)",
    "Success500": "oklch(0.58 0.12 135)",
    "Success600": "oklch(0.50 0.12 135)",
    "Success700": "oklch(0.42 0.11 135)",
    "Danger50": "oklch(0.95 0.04 357.5)",
    "Danger100": "oklch(0.88 0.09 357.5)",
    "Danger500": "oklch(0.55 0.20 357.5)",
    "Danger600": "oklch(0.48 0.20 357.5)",
    "Danger700": "oklch(0.40 0.19 357.5)",
    "Warning50": "oklch(0.97 0.03 82.5)",
    "Warning100": "oklch(0.92 0.06 82.5)",
    "Warning500": "oklch(0.70 0.14 82.5)",
    "Warning600": "oklch(0.62 0.14 82.5)",
    "Info50": "oklch(0.95 0.025 167.5)",
    "Info100": "oklch(0.88 0.05 167.5)",
    "Info500": "oklch(0.58 0.12 167.5)",
    "Info600": "oklch(0.50 0.12 167.5)",
    "FontSans": "'Inter', -apple-system, BlinkMacSystemFont, 'Segoe UI', Roboto, Helvetica, Arial, sans-serif",
    "FontMono": "'JetBrains Mono', 'Fira Code', ui-monospace, monospace",
    "FontSerif": "Georgia, 'Times New Roman', serif",
    "RadiusNone": "0",
    "RadiusXs": "2px",
    "RadiusSm": "4px",
    "RadiusMd": "8px",
    "RadiusLg": "16px",
    "RadiusXl": "32px",
    "Radius2Xl": "64px",
    "RadiusFull": "9999px"
  },
  "light": {
    "bg": {
      "default": "oklch(0.99 0.003 220)",
      "subtle": "oklch(0.97 0.005 220)",
      "muted": "oklch(0.935 0.008 220)",
      "emphasized": "oklch(0.89 0.012 220)",
      "overlay": "oklch(0.16 0.02 220 / 0.40)",
      "glass": "oklch(0.99 0.003 220 / 0.7)"
    },
    "surface": {
      "default": "oklch(1 0 0)",
      "raised": "oklch(1 0 0)",
      "overlay": "oklch(1 0 0)"
    },
    "fg": {
      "default": "oklch(0.14 0.015 220)",
      "subtle": "oklch(0.36 0.012 220)",
      "muted": "oklch(0.52 0.01 220)",
      "disabled": "oklch(0.68 0.008 220)",
      "inverse": "oklch(0.99 0.003 220)",
      "link": "oklch(0.59 0.14 220)",
      "linkHover": "oklch(0.53 0.14 220)"
    },
    "border": {
      "default": "oklch(0.87 0.012 220)",
      "subtle": "oklch(0.93 0.01 220)",
      "strong": "oklch(0.80 0.015 220)",
      "focus": "oklch(0.59 0.14 220)"
    },
    "divider": "oklch(0.93 0.01 220)",
    "colorPrimary": {
      "default": "oklch(0.59 0.14 220)",
      "subtle": "oklch(0.94 0.04 220)",
      "hover": "oklch(0.53 0.14 220)",
      "fg": "oklch(0.99 0 0)"
    },
    "colorSuccess": {
      "default": "oklch(0.627 0.194 153.2)",
      "subtle": "oklch(0.94 0.04 153)",
      "hover": "oklch(0.57 0.19 153)",
      "fg": "oklch(0.99 0 0)"
    },
    "colorDanger": {
      "default": "oklch(0.55 0.20 357.5)",
      "subtle": "oklch(0.94 0.05 19)",
      "hover": "oklch(0.50 0.20 357.5)",
      "fg": "oklch(0.99 0 0)"
    },
    "colorWarning": {
      "default": "oklch(0.70 0.14 82.5)",
      "subtle": "oklch(0.96 0.04 83)",
      "hover": "oklch(0.64 0.14 82.5)",
      "fg": "oklch(0.14 0.020 220)"
    },
    "colorInfo": {
      "default": "oklch(0.58 0.12 167.5)",
      "subtle": "oklch(0.94 0.035 254)",
      "hover": "oklch(0.52 0.12 167.5)",
      "fg": "oklch(0.99 0 0)"
    },
    "font": {
      "default": "'Inter', system-ui, -apple-system, 'Segoe UI', Roboto, Helvetica, Arial, sans-serif",
      "mono": "'JetBrains Mono', ui-monospace, monospace"
    },
    "text": {
      "xs": "0.6875rem",
      "sm": "0.75rem",
      "base": "0.8125rem",
      "lg": "0.9375rem",
      "xl": "1.125rem",
      "2xl": "1.375rem",
      "3xl": "1.75rem"
    },
    "fontWeight": {
      "normal": "400",
      "medium": "500",
      "semibold": "600",
      "bold": "700"
    },
    "lineHeight": {
      "tight": "1.25",
      "normal": "1.5",
      "relaxed": "1.75"
    },
    "shadow": {
      "xs": "0 1px 1px 0 oklch(0.14 0.02 220 / 0.04)",
      "sm": "0 1px 2px 0 oklch(0.14 0.02 220 / 0.06), 0 1px 1px -1px oklch(0.14 0.02 220 / 0.06)",
      "md": "0 2px 4px -1px oklch(0.14 0.02 220 / 0.08), 0 1px 2px -1px oklch(0.14 0.02 220 / 0.06)",
      "lg": "0 8px 16px -4px oklch(0.14 0.02 220 / 0.10), 0 2px 4px -2px oklch(0.14 0.02 220 / 0.06)",
      "xl": "0 16px 32px -8px oklch(0.14 0.02 220 / 0.14), 0 4px 8px -4px oklch(0.14 0.02 220 / 0.08)"
    },
    "radius": {
      "sm": "4px",
      "md": "8px",